{
  "$schema": "https://json-schema.org/draft/2020-12/schema",
  "title": "mathmodel-copilot result.json",
  "type": "object",
  "required": [
    "question_id",
    "status",
    "model_name",
    "inputs",
    "main_result",
    "metrics",
    "figures",
    "tables",
    "warnings",
    "trace",
    "created_at"
  ],
  "properties": {
    "question_id": {"type": "string"},
    "status": {"type": "string", "enum": ["pass", "partial", "fail"]},
    "model_name": {"type": "string"},
    "inputs": {"type": "object"},
    "main_result": {"type": "object"},
    "metrics": {"type": "object"},
    "figures": {"type": "array", "items": {"type": "string"}},
    "tables": {"type": "array", "items": {"type": "string"}},
    "warnings": {"type": "array", "items": {"type": "string"}},
    "trace": {
      "type": "object",
      "description": "Map important numbers to source files and fields."
    },
    "created_at": {"type": "string"}
  },
  "additionalProperties": false
}
