{
  "question_id": "q1",
  "status": "partial",
  "model_name": "<模型名称>",
  "inputs": {
    "source_files": ["<输入文件路径>"]
  },
  "main_result": {},
  "metrics": {},
  "figures": [],
  "tables": [],
  "warnings": ["<限制或风险>"],
  "trace": {
    "<字段名>": {
      "source_file": "<生成该字段的文件>",
      "source_field": "<字段或表格列>",
      "validation_status": "<pass/partial/fail>"
    }
  },
  "created_at": "<ISO-8601 时间>"
}
